id_upstream, name_concise, name_long, osm_relation
1, 30, Aeroport 游몢 str. 31 August 1989, 7390177
2, 32, St캒uceni 游몢 Chi탳in캒u, 8649765
,  37, Bubuieci 游몢 Gara Feroviar캒, 9478330
,  36, Ialoveni 游몢 str. Ismail, 9478295
,  35, Durle탳ti 游몢 str. V. Alecsandri, 9478243
,  34, str. Ciuflea 游몢 Tru탳eni, 9220092
,  31, S칙ngera 游몢 str. 31 August 1989, 8219936
,  12, str. A. Mateevici 游몢 bd. Mircea cel B캒tr칙n, 9220024
,  29, Universitatea Agrar캒 游몢 Gr캒dina public캒 "탲tefan cel Mare", 6768372
,  27, str. Ion Creang캒 游몢 str. Ceucari, 6768261
,  26, str. Ceucari 游몢 str. Mircea cel B캒tr칙n, 6768260
,  25, str. Ceucari 游몢 str. 31 august 1989, 6768231
,  24, Coloni탵a 游몢 str. Tighina, 6768200
,  23, str. Mircea cel B캒tr칙n 游몢 Parcul "La Izvor", 6768158
,  22, bd. Dacia 游몢 str. Alba游몢Iulia, 6768073
,  21, str. Me탳terul Manole 游몢 str. Alba游몢Iulia, 6768055
,  20, str. V. Dokuceaev 游몢 Parcul de troilebuze nr.2, 6767907
,  17, Gara Feroviar캒 游몢 Gara Auto de Sud游몢Vest, 6767859
,  13, str. V. Dokuceaev 游몢 bd. Mircea cel B캒tr칙n, 6755788
,  10, str. Miori탵a 游몢 bd. Moscova, 6755732
,  11, bd. Moscova 游몢 Parcul "La Izvor", 6862391
,  9, Gara Auto Sud游몢Vest 游몢 Gara Auto de Nord, 6754654
,  8, Parcul "La Izvor" 游몢 Bd. Traian, 6754630
,  7, str. Uzinelor 游몢 str. 31 August 1989, 6754620
,  5, Parcul de troleibuze nr.2 游몢 str. Bariera Sculeni, 6754537
,  4, bd. Dacia 游몢 str. Constitu탵iei, 6754503
,  3, str. Alba游몢Iulia 游몢 str. Miori탵a, 6754451
,  2, bd. Traian 游몢 str. A. Pu탳kin, 6754453
,  1, Durle탳ti 游몢 str. Sarmizegetusa, 6768282



